{
  "sample_id": "329872fe-bb08-56cb-9280-2eb54c42bbc0",
  "dataset_id": "D13",
  "asset_ids": [
    "673e264e-08fa-55df-b1e7-036e2fa5d30c"
  ],
  "source_group_ids": [
    "synthetic-v1"
  ],
  "source_authorization_ref": "synthetic-fixture-only-not-business-authority",
  "annotation_version": "synthetic-v1",
  "annotation_status": "reviewed",
  "reviewer_refs": [
    "synthetic-v1"
  ],
  "quality_tags": [],
  "payload": {
    "claim": {
      "subject": "synthetic-v1",
      "action": "synthetic-v1",
      "time": "synthetic-v1",
      "place": "synthetic-v1",
      "result": "synthetic-v1",
      "source_segment_ids": [
        "b5594744-c71d-5c6d-995d-833bd6766371"
      ]
    }
  }
}
